{
  "schema_version": 1,
  "task_id": "wt-smoke-c",
  "attempt": 0,
  "stage": "execute",
  "finished_at": "2026-05-16T17:56:33.216Z",
  "exit_code": 0,
  "output_bytes": 1096,
  "output_preview": "\u001b[0m\r\n> build · deepseek-v4-pro\r\n\u001b[0m\r\n\u001b[0m$ \u001b[0mmkdir -p test/worktree-parallel-smoke\r\n(no output)\r\n\u001b[0m\r\n\u001b[0m$ \u001b[0mgit config user.name && git config user.email\r\nBK201-Drama\n1243532812@qq.com\r\n\u001b[0m\r\n\u001b[0m← \u001b[0mWrite test/worktree-parallel-smoke/c.txt\r\nWrote file successfully.\r\n\u001b[0m\r\n\u001b[0m$ \u001b[0mgit add test/worktree-parallel-smoke/c.txt && git commit -m \"wt-smoke-c\"\r\nwarning: in the working copy of 'test/worktree-parallel-smoke/c.txt', LF will be replaced by CRLF the next time Git touches it\nOn branch agent-farm/wt-smoke-c\nnothing to commit, working tree clean\r\n\u001b[0m\r\n\u001b[0m$ \u001b[0mgit log --oneline -3\r\n5d54e4e agent-farm: merge task cp-1778951902902 (agent-farm/cp-1778951902902)\nb1b1a96 agent-farm(task cp-1778951902902): snapshot before worktree dispose\n3d9070a agent-farm: merge task cp-1778950738209 (agent-farm/cp-1778950738209)\r\n\u001b[0m\r\n\u001b[0m→ \u001b[0mRead test/worktree-parallel-smoke/c.txt\r\nDone. 文件 `test/worktree-parallel-smoke/c.txt` 已创建，内容为 `WT_SMOKE_C`。commit 结果显示 working tree clean（该文件可能已被之前的合并带入），文件已就位。\r\n"
}
